1779563723;25;laboratório móvel 1;Notebook;Media;Não se aplica;Intacto;Bateria não carrega;teste123;Professor(a);23/05/2026 16:15;Em Aberto;W3siYXV0b3IiOiJDb29yZGVuYWRvciBkbyBDdXJzbyIsInRleHRvIjoidGVzdGUiLCJob3JhIjoiMzBcL01heSAxNjoyNSJ9LHsiYXV0b3IiOiJDb29yZGVuYWRvciBkbyBDdXJzbyIsInRleHRvIjoidGVzdGFkbyA/IiwiaG9yYSI6IjMwXC9NYXkgMTY6MjYifSx7ImF1dG9yIjoiQ29vcmRlbmFkb3IgZG8gQ3Vyc28iLCJ0ZXh0byI6InRlc3RlIHBhcnRlIDIiLCJob3JhIjoiMzBcL01heSAxNjozMSJ9LHsiYXV0b3IiOiJQcm9mZXNzb3IoYSkiLCJ0ZXh0byI6InRlc3RlIHBhcnRlIDIiLCJob3JhIjoiMzBcL01heSAxNjozMSJ9XQ==
1779931170;15;lab1;Desktop;Media;Não se aplica;Não identificado (Professor não soube avaliar);Não liga;O computador não liga mais;Joel Rodrigues de Lira júnior;27/05/2026 22:19;Em Aberto
1779931209;7;lab móvel 1;Notebook;Alta;Não se aplica;Intacto;Bateria não carrega;O notebook parou de carregar;Joel Rodrigues de Lira júnior;27/05/2026 22:20;Em Aberto
1779931238;54;lab1;Monitor;Alta;Não se aplica;Intacto;Cabo com mau contato;o monitor não liga mais;Joel Rodrigues de Lira júnior;27/05/2026 22:20;Em Aberto
1779931339;14;sala 1;Cabo;Alta;Não se aplica;Intacto;Vírus;O aluno tentou baixar minecraft pirata mas acabou baixando um vírus ;Professor(a);27/05/2026 22:22;Resolvido;tentei resolver, olha ai
1779973525;123324234;sala 3;Notebook;Media;Não se aplica;Intacto;Liga mas sem imagem;dfghfghcghcfg;Professor(a);28/05/2026 10:05;Resolvido
1780169573;12;Sala 6;Notebook;Baixa;Não se aplica;Intacto;Não liga;teste com todas as modificações;Professor(a);30/05/2026 16:32;Em Aberto;W3siYXV0b3IiOiJQcm9mZXNzb3IoYSkiLCJ0ZXh0byI6ImZ1bmNpb25vdSBhaT8iLCJob3JhIjoiMzBcL01heSAxNjozMyJ9LHsiYXV0b3IiOiJDb29yZGVuYWRvciBkbyBDdXJzbyIsInRleHRvIjoidGVzdGFkbyIsImhvcmEiOiIzMFwvTWF5IDE2OjMzIn1d
